{
  "county_fips": "06029",
  "state_fips": "06",
  "county_name": "Kern County",
  "registry_version": "alice.county_coverage_registry.v1",
  "coverage_tier": "full",
  "capabilities": {
    "parcel_identity": "full",
    "zoning": "full",
    "planning_docs": "partial",
    "tax_roll": "full",
    "utilities": "partial",
    "environmental": "partial",
    "water": "minimal",
    "transmission": "partial",
    "broadband": "partial",
    "listings": "none"
  },
  "preferred_source_ids": [
    "county_ca_kern_parcelquest_property_search",
    "county_ca_kern_interactive_mapping",
    "county_ca_kern_gis_data",
    "state_ca_energy_commission_transmission",
    "federal_fema_nfhl",
    "federal_usfws_nwi",
    "federal_usda_soil_data_access",
    "federal_usgs_3dep_elevation",
    "federal_fcc_bdc_national",
    "federal_epa_ejscreen"
  ],
  "discovered_source_ids": [
    "county_ca_kern_parcelquest_property_search",
    "county_ca_kern_interactive_mapping",
    "county_ca_kern_gis_data",
    "local_ca_bakersfield_planning",
    "state_ca_energy_commission_transmission",
    "federal_fema_nfhl",
    "federal_usfws_nwi",
    "federal_usda_soil_data_access",
    "federal_usgs_3dep_elevation",
    "federal_fcc_bdc_national",
    "federal_epa_ejscreen"
  ],
  "known_limitations": [
    "County parcel and assessor coverage is strong, but planning-code interpretation still requires careful parcel-specific review.",
    "Utility service and water availability remain directional unless confirmed with the relevant local provider or district.",
    "Bakersfield local planning sources only apply when the parcel falls within city or city-influenced planning jurisdiction."
  ],
  "last_verified_at": "2026-04-16T08:00:00Z"
}
