{
  "county_fips": "48229",
  "state_fips": "48",
  "county_name": "Hudspeth County",
  "registry_version": "alice.county_coverage_registry.v1",
  "coverage_tier": "partial",
  "capabilities": {
    "parcel_identity": "full",
    "zoning": "none",
    "planning_docs": "partial",
    "tax_roll": "full",
    "utilities": "partial",
    "environmental": "partial",
    "water": "none",
    "transmission": "partial",
    "broadband": "partial",
    "listings": "none"
  },
  "preferred_source_ids": [
    "county_tx_hudspeth_cad_property_search",
    "county_tx_hudspeth_cad_public_information",
    "state_tx_stratmap_land_parcels",
    "state_tx_puc_electricity_maps",
    "federal_fema_nfhl",
    "federal_usfws_nwi",
    "federal_usda_soil_data_access",
    "federal_usgs_3dep_elevation",
    "federal_fcc_bdc_national",
    "federal_epa_ejscreen"
  ],
  "discovered_source_ids": [
    "county_tx_hudspeth_cad_property_search",
    "county_tx_hudspeth_cad_public_information",
    "county_tx_hudspeth_forms_and_applications",
    "state_tx_stratmap_land_parcels",
    "state_tx_puc_electricity_maps",
    "federal_fema_nfhl",
    "federal_usfws_nwi",
    "federal_usda_soil_data_access",
    "federal_usgs_3dep_elevation",
    "federal_fcc_bdc_national",
    "federal_epa_ejscreen"
  ],
  "known_limitations": [
    "Parcel identity and tax context are stronger than zoning visibility in Hudspeth County.",
    "County-level forms provide procedural clues, but parcel-specific development feasibility still requires local confirmation.",
    "Water-rights and utility feasibility remain unresolved without deeper state or local follow-up."
  ],
  "last_verified_at": "2026-04-16T08:00:00Z"
}
